postId,title,body,photoUrl,username
1,"Beneficios del ciclismo","El ciclismo es una actividad maravillosa que ofrece numerosos beneficios para la salud. En este post, exploraremos algunos de los beneficios más destacados.","https://planetatriatlon.com/wp-content/uploads/2018/01/Etape-Du-Tour-Brian%C3%A7on.jpg","ciclista1"
2,"Mejores rutas de ciclismo","Descubre algunas de las rutas de ciclismo más emocionantes en todo el mundo. Desde rutas de montaña hasta ciclismo de carretera, hay algo para todos los entusiastas del ciclismo.","https://planetatriatlon.com/wp-content/uploads/2018/01/Etape-Du-Tour-Brian%C3%A7on.jpg","ciclista2"
3,"Consejos para mantenimiento de bicicletas","Aprende cómo mantener tu bicicleta en óptimas condiciones para que siempre esté lista para la próxima aventura en dos ruedas. ¡Un mantenimiento adecuado es clave!","https://planetatriatlon.com/wp-content/uploads/2018/01/Etape-Du-Tour-Brian%C3%A7on.jpg","ciclista3"
4,"Ciclismo de carretera","Exploraremos el emocionante mundo del ciclismo de carretera y algunos consejos para mejorar tu técnica y disfrutar al máximo de tus paseos.","https://planetatriatlon.com/wp-content/uploads/2018/01/Etape-Du-Tour-Brian%C3%A7on.jpg","ciclista4"
5,"Elegir la bicicleta adecuada","La elección de la bicicleta adecuada es crucial para disfrutar al máximo del ciclismo. En este post, te guiaremos a través de los factores clave a considerar.","https://planetatriatlon.com/wp-content/uploads/2018/01/Etape-Du-Tour-Brian%C3%A7on.jpg","ciclista5"
